{"counts":{"accepted":3,"error":0,"rejected":1,"unsupported":1},"event_count":5,"event_trace_sha256":"sha256:ea9be00c29b2dcdf53f852195eb7003b5f9fa1ef5d1d330e0bc378f0364d3d48","final_state_sha256":"sha256:57d39ebe39403751cb9f7cd1d238753a97d7874b2a26105dad04c89f0a31230d","initial_state_sha256":"sha256:865dface4a33bdc47a31b242b7635004545bb005b75b1b2a1497604695838267","manifest_sha256":"sha256:f4dca9cffdd37866e8a6c76f5db2090ddbeaaf0f5b4eb5248cf6f7edf2d85876","run_id":"run-aaa790b836d826c55da5b477","schema_version":1}
