{"counts":{"accepted":3,"error":0,"rejected":1,"unsupported":1},"event_count":5,"event_trace_sha256":"sha256:7b8ab6f9a3f0c060a4fc5d79a7341ab1bd60590ea728e3e142d13fcb9318deb5","final_state_sha256":"sha256:57d39ebe39403751cb9f7cd1d238753a97d7874b2a26105dad04c89f0a31230d","initial_state_sha256":"sha256:865dface4a33bdc47a31b242b7635004545bb005b75b1b2a1497604695838267","manifest_sha256":"sha256:f3f335d2dcedffce32558f130e0974344f9561c69e4361b7b43def90de71ce59","run_id":"run-be30c7a68e8a732c789a28a3","schema_version":1}
