{"counts":{"accepted":3,"error":0,"rejected":1,"unsupported":1},"event_count":5,"event_trace_sha256":"sha256:7e7504c55d49042bd3af7308246e65efbe6d118a6cc4fa9abf60b5333c7c0dff","final_state_sha256":"sha256:57d39ebe39403751cb9f7cd1d238753a97d7874b2a26105dad04c89f0a31230d","initial_state_sha256":"sha256:865dface4a33bdc47a31b242b7635004545bb005b75b1b2a1497604695838267","manifest_sha256":"sha256:a7b78cfa6a919f3335879741556bffac39ac188d4849f14306a374477ce34027","run_id":"run-25461cb9e642f5f1573653ba","schema_version":1}
