{"counts":{"accepted":3,"error":0,"rejected":1,"unsupported":1},"event_count":5,"event_trace_sha256":"sha256:93bd58cbb12d669dce74718ba5f5b8bee4bdae5004002ff18bd0559d02397872","final_state_sha256":"sha256:57d39ebe39403751cb9f7cd1d238753a97d7874b2a26105dad04c89f0a31230d","initial_state_sha256":"sha256:865dface4a33bdc47a31b242b7635004545bb005b75b1b2a1497604695838267","manifest_sha256":"sha256:a021636ccf52d38b8e555b6e46aff1fa01ab7d832b8b7e60842ddbd7070c730a","run_id":"run-6c62c2be0d29c49ebf0d3c07","schema_version":1}
